{
  "$schema": "https://json-schema.org/draft/2020-12/schema", "$id": "https://equivista.net/schemas/batch14-candidate-governance.schema.json",
  "title": "EquiVista Batch 14 Offline Candidate Governance", "type": "object", "additionalProperties": false,
  "required": ["version", "batch", "mode", "status", "evaluation_contract_version", "governance_contract_version", "approved_batch13_evaluation_hash", "rejection_codes", "safety", "fixtures", "evidence_ref"],
  "properties": { "version": { "const": 1 }, "batch": { "const": 14 }, "mode": { "const": "offline-candidate-governance" }, "status": { "const": "in-progress" }, "evaluation_contract_version": { "const": "experiment-evaluation-v1" }, "governance_contract_version": { "const": "candidate-governance-v1" }, "approved_batch13_evaluation_hash": { "type": "string", "pattern": "^[a-f0-9]{64}$" }, "rejection_codes": { "type": "array", "uniqueItems": true }, "safety": { "type": "object" }, "fixtures": { "type": "array", "minItems": 6 }, "evidence_ref": { "type": "string", "pattern": "^docs/" } }
}
